question,answer
How can I contact Schönline?,"Use the website contact form, call +1 (212) 461-1725, or email info@schonline.com."
I want to contact Schönline.,"Use the website contact form, call +1 (212) 461-1725, or email info@schonline.com."
How can I find Schönline's address?,"The website lists 240 West 37th St, Suite 303, New York, NY 10018."
I want to find Schönline's address.,"The website lists 240 West 37th St, Suite 303, New York, NY 10018."
How can I learn what product series are available?,"The US website lists LINE90, PRIME70, PRIME Sliding, LINE70 Sliding, and PRIMELINE."
I want to learn what product series are available.,"The US website lists LINE90, PRIME70, PRIME Sliding, LINE70 Sliding, and PRIMELINE."
How can I understand what LINE90 is?,LINE90 is a high-insulation series with a 90 mm frame depth and a six-chamber profile system.
I want to understand what LINE90 is.,LINE90 is a high-insulation series with a 90 mm frame depth and a six-chamber profile system.
How can I find the LINE90 frame depth?,"LINE90 has a listed frame depth of 3 9/16 inches, or 90 mm."
I want to find the LINE90 frame depth.,"LINE90 has a listed frame depth of 3 9/16 inches, or 90 mm."
How can I know whether LINE90 supports triple glazing?,Yes. LINE90 is presented as capable of accommodating triple glazing.
I want to know whether LINE90 supports triple glazing.,Yes. LINE90 is presented as capable of accommodating triple glazing.
How can I know whether LINE90 is energy efficient?,Yes. It is designed for maximum energy efficiency and strong thermal insulation.
I want to know whether LINE90 is energy efficient.,Yes. It is designed for maximum energy efficiency and strong thermal insulation.
How can I learn about LINE90 seals?,"The LINE90 triple-seal system is described as helping protect against cold, dust, rainwater, and outside noise."
I want to learn about LINE90 seals.,"The LINE90 triple-seal system is described as helping protect against cold, dust, rainwater, and outside noise."
How can I know whether LINE90 is Passive House compliant?,The website states that LINE90 is fully compliant with Passive House regulations.
I want to know whether LINE90 is Passive House compliant.,The website states that LINE90 is fully compliant with Passive House regulations.
How can I understand what PRIME70 is?,"PRIME70 is a 70 mm, six-chamber series combining insulation, security, and aesthetics."
I want to understand what PRIME70 is.,"PRIME70 is a 70 mm, six-chamber series combining insulation, security, and aesthetics."
How can I find the PRIME70 frame depth?,"PRIME70 has a listed frame depth of 2 3/4 inches, or 70 mm."
I want to find the PRIME70 frame depth.,"PRIME70 has a listed frame depth of 2 3/4 inches, or 70 mm."
How can I learn what glazing PRIME70 supports?,"The website lists single, double, or triple glazing."
I want to learn what glazing PRIME70 supports.,"The website lists single, double, or triple glazing."
How can I understand PRIME70 security?,"The page describes reinforced frames, advanced locking systems, and RC2-rated burglary protection."
I want to understand PRIME70 security.,"The page describes reinforced frames, advanced locking systems, and RC2-rated burglary protection."
How can I learn about PRIME70 performance standards?,"The product page lists standards for air, water, wind load, thermal performance, solar heat gain, and sound transmission."
I want to learn about PRIME70 performance standards.,"The product page lists standards for air, water, wind load, thermal performance, solar heat gain, and sound transmission."
How can I understand what PRIME Sliding is?,PRIME Sliding is a large-format sliding system designed for smooth operation and thermal performance.
I want to understand what PRIME Sliding is.,PRIME Sliding is a large-format sliding system designed for smooth operation and thermal performance.
How can I find the PRIME Sliding depth?,"The website lists a system depth of 6 1/16 inches, or 154 mm."
I want to find the PRIME Sliding depth.,"The website lists a system depth of 6 1/16 inches, or 154 mm."
How can I know whether PRIME Sliding supports large openings?,Yes. It is presented for extra-large sizes and spacious modern living areas.
I want to know whether PRIME Sliding supports large openings.,Yes. It is presented for extra-large sizes and spacious modern living areas.
How can I understand what LINE70 Sliding is?,"LINE70 Sliding is a configurable sliding system focused on comfort, protection, insulation, and modern design."
I want to understand what LINE70 Sliding is.,"LINE70 Sliding is a configurable sliding system focused on comfort, protection, insulation, and modern design."
How can I learn LINE70 Sliding track options?,"The website describes mono, double, and triple track configurations."
I want to learn LINE70 Sliding track options.,"The website describes mono, double, and triple track configurations."
How can I know whether LINE70 Sliding has insect screens?,The page describes integrated insect-screen options.
I want to know whether LINE70 Sliding has insect screens.,The page describes integrated insect-screen options.
How can I know whether LINE70 Sliding reduces noise?,Yes. It is presented as providing thermal and sound insulation.
I want to know whether LINE70 Sliding reduces noise.,Yes. It is presented as providing thermal and sound insulation.
How can I know how many sashes LINE70 Sliding supports?,The website states that configurations can accommodate up to six operable sashes.
I want to know how many sashes LINE70 Sliding supports.,The website states that configurations can accommodate up to six operable sashes.
How can I understand what PRIMELINE is?,PRIMELINE is an aluminum-cladding solution for Schönline uPVC window and door systems.
I want to understand what PRIMELINE is.,PRIMELINE is an aluminum-cladding solution for Schönline uPVC window and door systems.
How can I know whether PRIMELINE comes in different colors?,The website states that the aluminum cladding can be manufactured in any color to match project requirements.
I want to know whether PRIMELINE comes in different colors.,The website states that the aluminum cladding can be manufactured in any color to match project requirements.
How can I learn how PRIMELINE improves insulation?,The air gap between aluminum and uPVC is described as acting as an additional insulating chamber.
I want to learn how PRIMELINE improves insulation.,The air gap between aluminum and uPVC is described as acting as an additional insulating chamber.
How can I learn what uPVC means?,"uPVC means unplasticized polyvinyl chloride, a durable plastic commonly used for window and door profiles."
I want to learn what uPVC means.,"uPVC means unplasticized polyvinyl chloride, a durable plastic commonly used for window and door profiles."
How can I know whether uPVC is low maintenance?,Yes. The website describes uPVC as virtually maintenance-free and easy to clean.
I want to know whether uPVC is low maintenance.,Yes. The website describes uPVC as virtually maintenance-free and easy to clean.
How can I know whether uPVC is weather resistant?,"It is described as resistant to UV exposure, moisture, humidity, and extreme weather."
I want to know whether uPVC is weather resistant.,"It is described as resistant to UV exposure, moisture, humidity, and extreme weather."
How can I know whether uPVC is recyclable?,The website states that uPVC is 100% recyclable.
I want to know whether uPVC is recyclable.,The website states that uPVC is 100% recyclable.
How can I know whether uPVC can have different finishes?,Yes. The website describes a wide range of colors and finishes.
I want to know whether uPVC can have different finishes.,Yes. The website describes a wide range of colors and finishes.
How can I understand an insulated glass unit?,An IGU is a sealed assembly of two or more glass panes separated by a spacer and insulating space.
I want to understand an insulated glass unit.,An IGU is a sealed assembly of two or more glass panes separated by a spacer and insulating space.
How can I understand a casement window?,A casement window is attached by side hinges and opens inward or outward.
I want to understand a casement window.,A casement window is attached by side hinges and opens inward or outward.
How can I understand a window frame?,"The frame surrounds and supports the window or door and includes the head, sill, and jambs."
I want to understand a window frame.,"The frame surrounds and supports the window or door and includes the head, sill, and jambs."
How can I understand a tilt-and-turn window?,It can tilt inward at the top for ventilation or open fully using the handle.
I want to understand a tilt-and-turn window.,It can tilt inward at the top for ventilation or open fully using the handle.
How can I understand a chamber in a profile?,"A chamber is a hollow internal section that contributes to insulation, drainage, and structural performance."
I want to understand a chamber in a profile.,"A chamber is a hollow internal section that contributes to insulation, drainage, and structural performance."
How can I understand weep holes?,Weep holes are small frame openings that allow water to drain away.
I want to understand weep holes.,Weep holes are small frame openings that allow water to drain away.
How can I understand TPV gaskets?,TPV gaskets are flexible sealing components used to improve airtightness and watertightness.
I want to understand TPV gaskets.,TPV gaskets are flexible sealing components used to improve airtightness and watertightness.
How can I understand double-pane glass?,Double-pane glass uses two panes with a sealed insulating space between them.
I want to understand double-pane glass.,Double-pane glass uses two panes with a sealed insulating space between them.
How can I understand triple-pane glass?,Triple-pane glass uses three panes and two insulating spaces for improved thermal and acoustic performance.
I want to understand triple-pane glass.,Triple-pane glass uses three panes and two insulating spaces for improved thermal and acoustic performance.
How can I understand reinforcement steel?,"Reinforcement steel is installed inside uPVC frames to add rigidity, dimensional stability, and security."
I want to understand reinforcement steel.,"Reinforcement steel is installed inside uPVC frames to add rigidity, dimensional stability, and security."
How can I understand Low-E glass?,Low-E glass has a thin coating that helps control heat transfer.
I want to understand Low-E glass.,Low-E glass has a thin coating that helps control heat transfer.
How can I understand argon gas in windows?,Argon can fill spaces between glass panes to reduce heat transfer.
I want to understand argon gas in windows.,Argon can fill spaces between glass panes to reduce heat transfer.
How can I understand U-value?,U-value measures heat-transfer rate; a lower U-value indicates better insulation.
I want to understand U-value.,U-value measures heat-transfer rate; a lower U-value indicates better insulation.
How can I understand SHGC?,Solar Heat Gain Coefficient indicates how much solar heat passes through the glass.
I want to understand SHGC.,Solar Heat Gain Coefficient indicates how much solar heat passes through the glass.
How can I understand a thermal break?,A thermal break is an insulating layer that reduces heat transfer through a frame.
I want to understand a thermal break.,A thermal break is an insulating layer that reduces heat transfer through a frame.
How can I understand condensation resistance?,It describes a window's ability to resist condensation forming on its interior surface.
I want to understand condensation resistance.,It describes a window's ability to resist condensation forming on its interior surface.
How can I understand acoustic performance?,Acoustic performance describes how effectively a window reduces outside noise transmission.
I want to understand acoustic performance.,Acoustic performance describes how effectively a window reduces outside noise transmission.
How can I understand laminated glass?,Laminated glass bonds layers with a plastic interlayer to improve strength and hold fragments together.
I want to understand laminated glass.,Laminated glass bonds layers with a plastic interlayer to improve strength and hold fragments together.
How can I understand tempered glass?,Tempered glass is heat-treated safety glass that breaks into smaller blunt pieces.
I want to understand tempered glass.,Tempered glass is heat-treated safety glass that breaks into smaller blunt pieces.
How can I request a project-specific recommendation?,"The chatbot can explain published features, but final measurements, pricing, availability, and product selection should be confirmed directly with Schönline."
I want to request a project-specific recommendation.,"The chatbot can explain published features, but final measurements, pricing, availability, and product selection should be confirmed directly with Schönline."
